{
  "schema": "specnav.verification.evidence-index.v1",
  "index_version": 1,
  "change_id": "change-v2",
  "generated_at": "2026-07-31T00:00:02Z",
  "source_raw": "evidence/raw.jsonl",
  "source_digest": "4444444444444444444444444444444444444444444444444444444444444444",
  "record_count": 0,
  "entries": []
}
